[
  {
    "schema_version": "v35.data_source_profile.v1",
    "provider": "pubchem",
    "display_name": "PubChem",
    "source_family": "molecule_identity",
    "base_url": "https://pubchem.ncbi.nlm.nih.gov/rest/pug",
    "license_hint": "PubChem data terms; cite NCBI PubChem",
    "license_scope": "source_record",
    "trust_level": "T3_literature_machine",
    "default_curation_status": "machine_extracted",
    "rate_limit": {
      "requests_per_second": 5,
      "backoff_strategy": "exponential"
    },
    "requires_api_key": false,
    "cache_ttl_hours": 720,
    "allowed_output_fields": [
      "cid",
      "canonical_smiles",
      "inchi_key",
      "molecular_formula",
      "molecular_weight",
      "xlogp",
      "tpsa",
      "hbd_count",
      "hba_count",
      "synonyms",
      "ambiguity_flag",
      "ambiguous_cids",
      "resolution_status"
    ],
    "review_triggers": [
      "ambiguous_identity",
      "name_only_match",
      "missing_inchi_key",
      "conflicting_source_identity",
      "license_scope_uncertain"
    ],
    "go_migration_state": "parity_required",
    "python_bridge_required": false,
    "typescript_surface": "source_coverage_and_settings_only",
    "disambiguation_required": true,
    "operational_status": "active",
    "capabilities": [
      "identity"
    ],
    "execution_modes": [
      "direct",
      "enrichment"
    ],
    "last_verified_at": "2026-07-10",
    "data_library_path": "data/lib/pubchem",
    "v35_slice": "p0_live_provider",
    "acquisition_mode": "api_lookup",
    "distribution_policy": "derived_facts_with_source_pointers"
  },
  {
    "schema_version": "v35.data_source_profile.v1",
    "provider": "nomad",
    "display_name": "NOMAD Materials",
    "source_family": "computed_materials",
    "base_url": "https://nomad-lab.eu/prod/v1/api/v1",
    "license_hint": "NOMAD public data terms",
    "license_scope": "source_record",
    "trust_level": "T2_computed_db",
    "default_curation_status": "machine_extracted",
    "rate_limit": {
      "requests_per_second": 2,
      "backoff_strategy": "exponential"
    },
    "requires_api_key": false,
    "cache_ttl_hours": 168,
    "allowed_output_fields": [
      "band_gap_ev",
      "homo_ev",
      "lumo_ev",
      "chemical_formula",
      "space_group",
      "xc_functional",
      "computed"
    ],
    "review_triggers": [
      "missing_license",
      "missing_source_url",
      "computed_schema_unrecognized",
      "unit_conversion_uncertain"
    ],
    "go_migration_state": "deferred",
    "python_bridge_required": false,
    "typescript_surface": "source_coverage_and_settings_only",
    "disambiguation_required": false,
    "operational_status": "experimental",
    "capabilities": [
      "electronic_structure",
      "computed_material_summary"
    ],
    "execution_modes": [
      "direct"
    ],
    "last_verified_at": "2026-07-19",
    "data_library_path": null,
    "v35_slice": "out_of_current_slice",
    "acquisition_mode": "api_lookup",
    "distribution_policy": "derived_facts_with_source_pointers"
  },
  {
    "schema_version": "v35.data_source_profile.v1",
    "provider": "pubchemqc",
    "display_name": "PubChemQC",
    "source_family": "computed_molecule",
    "base_url": "https://pubchemqc.riken.jp/api",
    "license_hint": "PubChemQC public dataset terms; cite PubChemQC and original quantum chemistry calculations",
    "license_scope": "dataset_snapshot",
    "trust_level": "T2_computed_db",
    "default_curation_status": "machine_extracted",
    "rate_limit": {
      "requests_per_second": 2,
      "backoff_strategy": "exponential"
    },
    "requires_api_key": false,
    "cache_ttl_hours": 168,
    "allowed_output_fields": [
      "pubchem_cid",
      "homo_ev",
      "lumo_ev",
      "band_gap_ev",
      "method",
      "basis_set",
      "computed"
    ],
    "review_triggers": [
      "snapshot_missing",
      "method_basis_missing",
      "identity_join_missing",
      "unit_conversion_uncertain",
      "license_scope_uncertain"
    ],
    "go_migration_state": "python_bridge_retained",
    "python_bridge_required": true,
    "typescript_surface": "settings_and_import_commands",
    "disambiguation_required": false,
    "operational_status": "quarantined",
    "capabilities": [
      "electronic_structure"
    ],
    "execution_modes": [
      "direct"
    ],
    "last_verified_at": null,
    "data_library_path": "data/lib/pubchemqc",
    "v35_slice": "p0_local_snapshot",
    "acquisition_mode": "local_snapshot",
    "distribution_policy": "derived_facts_with_source_pointers"
  },
  {
    "schema_version": "v35.data_source_profile.v1",
    "provider": "crossref",
    "display_name": "Crossref",
    "source_family": "literature_metadata",
    "base_url": "https://api.crossref.org",
    "license_hint": "Crossref REST API terms",
    "license_scope": "source_record",
    "trust_level": "T3_literature_machine",
    "default_curation_status": "machine_extracted",
    "rate_limit": {
      "requests_per_second": 10,
      "backoff_strategy": "exponential"
    },
    "requires_api_key": false,
    "cache_ttl_hours": 168,
    "allowed_output_fields": [
      "doi",
      "title",
      "journal",
      "published_at",
      "authors",
      "license",
      "retraction_flag"
    ],
    "review_triggers": [
      "missing_license",
      "doi_ambiguous",
      "retraction_flag"
    ],
    "go_migration_state": "deferred",
    "python_bridge_required": false,
    "typescript_surface": "source_coverage_and_settings_only",
    "disambiguation_required": false,
    "operational_status": "active",
    "capabilities": [
      "literature_metadata"
    ],
    "execution_modes": [
      "direct"
    ],
    "last_verified_at": "2026-07-10",
    "data_library_path": null,
    "v35_slice": "out_of_current_slice",
    "acquisition_mode": "api_lookup",
    "distribution_policy": "derived_facts_with_source_pointers"
  },
  {
    "schema_version": "v35.data_source_profile.v1",
    "provider": "openalex",
    "display_name": "OpenAlex",
    "source_family": "literature_metadata",
    "base_url": "https://api.openalex.org",
    "license_hint": "OpenAlex CC0 data",
    "license_scope": "source_record",
    "trust_level": "T3_literature_machine",
    "default_curation_status": "machine_extracted",
    "rate_limit": {
      "requests_per_second": 10,
      "backoff_strategy": "exponential"
    },
    "requires_api_key": true,
    "api_key_env": "OPENALEX_API_KEY",
    "cache_ttl_hours": 168,
    "allowed_output_fields": [
      "openalex_id",
      "doi",
      "title",
      "concepts",
      "oa_status",
      "cited_by_count"
    ],
    "review_triggers": [
      "doi_ambiguous",
      "missing_open_access_status",
      "license_scope_uncertain"
    ],
    "go_migration_state": "deferred",
    "python_bridge_required": false,
    "typescript_surface": "source_coverage_and_settings_only",
    "disambiguation_required": false,
    "operational_status": "experimental",
    "capabilities": [
      "literature_metadata"
    ],
    "execution_modes": [
      "direct"
    ],
    "last_verified_at": null,
    "data_library_path": null,
    "v35_slice": "out_of_current_slice",
    "acquisition_mode": "api_lookup",
    "distribution_policy": "derived_facts_with_source_pointers"
  },
  {
    "schema_version": "v35.data_source_profile.v1",
    "provider": "custom_htl_dft",
    "display_name": "Custom HTL DFT",
    "source_family": "project_generated",
    "base_url": "file://data/custom_htl_pilot/",
    "license_hint": "Project-generated calculations; source structures retain their own provenance",
    "license_scope": "project_generated",
    "trust_level": "T1_calculated",
    "default_curation_status": "calculated",
    "rate_limit": {
      "requests_per_second": 1,
      "backoff_strategy": "none"
    },
    "requires_api_key": false,
    "cache_ttl_hours": 8760,
    "allowed_output_fields": [
      "homo_ev",
      "lumo_ev",
      "band_gap_ev"
    ],
    "review_triggers": [
      "structure_provenance_missing",
      "method_basis_missing",
      "source_license_missing"
    ],
    "go_migration_state": "deferred",
    "python_bridge_required": true,
    "typescript_surface": "source_coverage_and_settings_only",
    "disambiguation_required": false,
    "operational_status": "experimental",
    "capabilities": [
      "electronic_structure"
    ],
    "execution_modes": [
      "local_dataset"
    ],
    "last_verified_at": null,
    "data_library_path": null,
    "v35_slice": "out_of_current_slice",
    "acquisition_mode": "local_dataset",
    "distribution_policy": "project_generated"
  },
  {
    "schema_version": "v35.data_source_profile.v1",
    "provider": "materials_project",
    "display_name": "Materials Project",
    "source_family": "computed_materials",
    "base_url": "https://api.materialsproject.org",
    "license_hint": "Materials Project API terms",
    "license_scope": "api_terms_record",
    "trust_level": "T2_computed_db",
    "default_curation_status": "machine_extracted",
    "rate_limit": {
      "requests_per_second": 2,
      "backoff_strategy": "exponential"
    },
    "requires_api_key": true,
    "api_key_env": "MATERIALS_PROJECT_API_KEY",
    "cache_ttl_hours": 168,
    "allowed_output_fields": [
      "material_id",
      "formula",
      "band_gap_ev",
      "formation_energy_ev_per_atom",
      "energy_above_hull",
      "density",
      "space_group",
      "computed"
    ],
    "review_triggers": [
      "missing_api_key",
      "license_scope_uncertain",
      "database_version_missing",
      "structure_identity_ambiguous"
    ],
    "go_migration_state": "parity_required",
    "python_bridge_required": false,
    "typescript_surface": "source_coverage_settings_and_commands",
    "disambiguation_required": false,
    "operational_status": "active",
    "capabilities": [
      "electronic_structure",
      "computed_material_summary"
    ],
    "execution_modes": [